{
  "schema": "autan.bench-result/1",
  "suite": "metal_stream",
  "created": "2026-11-01T07:52:53+00:00",
  "provenance": {
    "solver": {
      "commit": "ce679f3ce8552d15eb838563128697f713e57b8c",
      "dirty": false
    },
    "binary_sha256": "9b842b309038f24438e0d34962c590f1a803376b01854233f31fbcad652a2ece",
    "host": "MacBook-Pro-BaptisteCruvellier",
    "image": null,
    "image_revision": null,
    "backend": "metal",
    "precision": "fp32",
    "devices": {
      "kind": "metal",
      "count": 1
    },
    "runtime_version": 26071,
    "driver_version": 26071,
    "gpu": {
      "name": "Apple M4 Pro",
      "registry_id": "4294968456",
      "gpu_cores": 20,
      "recommended_max_working_set_bytes": 40200896512,
      "memory_bytes": 51539607552
    },
    "os_version": "26.7.1"
  },
  "conditions": {
    "lock": "/Users/baptistec/.autan-gpu.lock",
    "lock_wait_s": 4.292000085115433e-06,
    "idle_check": {
      "samples": 5,
      "compute_apps_max": null,
      "utilization_pct_max": 5.0
    },
    "host_load": {
      "cpus": 14,
      "before_1m": 4.13427734375,
      "after_1m": 5.3076171875
    },
    "during_run": {
      "samples": 134,
      "busy_samples": 133,
      "busy_threshold_pct": 5.0,
      "utilization_pct": {
        "min": 4.0,
        "median": 15.5,
        "max": 20.0
      },
      "sm_mhz": null,
      "sm_max_mhz": null,
      "power_w": null,
      "temperature_c": null,
      "clocks_event_reasons": null,
      "compute_apps_max": null
    },
    "setup_seconds": {
      "metal_compile": 0.004
    }
  },
  "config": {
    "elements": 268435456,
    "element_bytes": 4,
    "warmup": 10,
    "reps": 100,
    "batch": 5,
    "block": 256
  },
  "benchmarks": [
    {
      "name": "metal_stream.copy",
      "metric": "bandwidth",
      "unit": "GB/s",
      "better": "higher",
      "bytes_per_rep": 2147483648,
      "samples": [
        199.3574691870169,
        197.25965263220957,
        199.41177211488562,
        198.48866923771914,
        201.8012980221443,
        200.43528098405787,
        199.23632242808287,
        198.12334002975334,
        199.90694067893932,
        201.1074158997805,
        204.22223941241867,
        202.8567338775802,
        201.60884482377264,
        204.09333139458874,
        204.48135611399755,
        202.85593538518748,
        200.66986868817895,
        204.13536726027374,
        203.8772875563049,
        201.5475067735518,
        199.15687161199008,
        202.86966891198765,
        204.42604267528327,
        206.23085874956837,
        205.41188107024288,
        197.83860502746705,
        197.42346797316773,
        198.35758191260655,
        198.25000036442276,
        200.68862206131655,
        201.1678580498725,
        202.73097918156478,
        201.54845275776225,
        202.3079431982648,
        198.0869424535589,
        204.14620108390795,
        204.44144875227133,
        204.37772774549643,
        202.80724287248682,
        201.18607603714716,
        205.26756895871915,
        203.41990924070544,
        205.34460865212077,
        201.8729101846756,
        203.5941214641842,
        205.1623254290574,
        204.74747499796675,
        204.27987217661604,
        201.52418060228402,
        205.22179779153748,
        204.01512906396022,
        196.33373295544288,
        198.0587766098892,
        204.55342243061173,
        205.29160712316312,
        205.45790081787828,
        202.46673240724317,
        200.49750330811963,
        203.89648378401245,
        203.15130341927494,
        199.77567797413613,
        198.1463434964851,
        206.10434862478104,
        204.6586915130646,
        205.41564709663257,
        204.68014810979886,
        200.53666597784562,
        205.22392196589124,
        205.97535891352496,
        203.14537751367158,
        200.6408081757812,
        204.99814073145993,
        204.2832728628838,
        205.47903478765116,
        204.83014818739954,
        200.0667960808242,
        203.7030748252859,
        205.90475554916344,
        204.76211599347403,
        203.0232635677786,
        203.93908352544273,
        203.62549230986,
        205.40009286794745,
        204.40350407212048,
        201.5115733270776,
        204.92054649858423,
        206.33951336876055,
        205.99610606744392,
        197.9565364959773,
        198.2522879471427,
        201.7461610323176,
        201.23917835457877,
        201.84919217411328,
        200.68252632892325,
        193.47004621593598,
        203.89842031299327,
        200.05716675904924,
        196.7940257867677,
        198.19434705788154,
        202.93964534093917
      ],
      "stats": {
        "n": 100,
        "median": 202.8632013947839,
        "q1": 200.4819477271042,
        "q3": 204.4993726931511,
        "iqr": 4.017424966046889,
        "mean": 202.27657504199684,
        "stdev": 2.7963146395669174,
        "cv": 0.01382421389617826,
        "min": 193.47004621593598,
        "max": 206.33951336876055
      }
    },
    {
      "name": "metal_stream.scale",
      "metric": "bandwidth",
      "unit": "GB/s",
      "better": "higher",
      "bytes_per_rep": 2147483648,
      "samples": [
        205.29929398531334,
        201.21073831518768,
        202.25681521042057,
        202.5001432316343,
        201.03352294298062,
        200.71019237081453,
        198.96481713324053,
        202.35814438594122,
        202.07759462509745,
        196.23789740955502,
        201.75705966456778,
        197.61301081602724,
        199.04934347798965,
        196.64610702456176,
        197.794113435284,
        195.42876578212258,
        194.26066388352413,
        201.9317558521975,
        200.43294368163052,
        202.01850544427742,
        201.3269071395243,
        202.34384437754468,
        203.17933412448957,
        202.77787923830877,
        203.50472854773753,
        201.9857284930411,
        200.89169312482642,
        199.32138714080537,
        203.42906296077595,
        204.47681296361975,
        205.63004331450068,
        204.57729283435344,
        203.7866787392554,
        203.30676815514863,
        203.54716453896776,
        204.19990746740294,
        204.44096218038837,
        202.79910393560604,
        204.3480695936815,
        204.5207909381204,
        204.7160828368016,
        195.6006876182991,
        200.18024730255647,
        204.03935884688204,
        203.632089058307,
        202.78809243617178,
        204.33057084956545,
        202.13529082884222,
        202.82065144116822,
        204.55049925075272,
        204.0650498879369,
        204.29315220720872,
        200.48549301833015,
        198.79736132211912,
        203.35923106424687,
        202.93469081859305,
        199.72520151326506,
        205.50607219276486,
        204.99683665755555,
        203.09878676032216,
        205.29602306846235,
        202.24618003665222,
        204.19764269840954,
        203.81359503804353,
        204.66698039899555,
        203.5749821245585,
        203.45492089363748,
        204.36978551815344,
        203.86890109683625,
        204.37140662844092,
        203.7531651053682,
        203.5077827555134,
        204.85440976384817,
        204.23259862669855,
        205.0867291928133,
        202.60283098190385,
        205.7533434205201,
        202.35496651637263,
        203.76363706471457,
        203.25721855856327,
        203.5100314762715,
        203.97443552359272,
        203.8439047153795,
        205.1028883098049,
        202.96649736425653,
        202.414728924951,
        203.0122286724921,
        202.46021094598893,
        204.2950962783575,
        200.9228624349296,
        200.18226857853068,
        201.9350795676066,
        204.7194980620623,
        200.7907321727437,
        202.266499519203,
        202.30699007117684,
        202.56572483640664,
        202.20777601625034,
        204.28294891834716,
        205.31957615345385
      ],
      "stats": {
        "n": 100,
        "median": 203.05550771640713,
        "q1": 201.93424863875433,
        "q3": 204.2451861996107,
        "iqr": 2.310937560856388,
        "mean": 202.54138112422467,
        "stdev": 2.363912503217863,
        "cv": 0.0116712569554762,
        "min": 194.26066388352413,
        "max": 205.7533434205201
      }
    },
    {
      "name": "metal_stream.add",
      "metric": "bandwidth",
      "unit": "GB/s",
      "better": "higher",
      "bytes_per_rep": 3221225472,
      "samples": [
        211.30006521847082,
        209.29336608670212,
        209.927040027514,
        210.0277578123561,
        211.59802290235544,
        211.14713332486778,
        210.03255070624073,
        210.07592580348623,
        210.3235085784742,
        211.06988596632016,
        210.35589983590302,
        209.95702853280224,
        212.49415638269522,
        208.92967353143595,
        202.65684419132464,
        212.42269051825772,
        209.39892010843138,
        211.2947522158944,
        211.59964499730322,
        210.82353349203888,
        210.79582586259713,
        210.75939162630075,
        209.98166440811806,
        207.91332955217462,
        209.45474561473964,
        211.14102046534953,
        210.05617669744123,
        208.7210801118258,
        212.1918071765347,
        209.36568919845382,
        211.16305086878523,
        210.96079853204614,
        208.6583235841139,
        204.18507690036512,
        209.24453602086453,
        209.40561329618606,
        209.36262733819555,
        208.95542393056496,
        209.80648945346087,
        209.9684334133452,
        210.72251094738684,
        209.17478604573074,
        210.11143871141044,
        211.54869071194932,
        209.6217163569632,
        209.35695835003898,
        208.5590277743382,
        207.89644475223614,
        210.18627177120598,
        209.9766455303234,
        210.01018487229933,
        208.92515672883596,